{"artifact_digest":"379795ca36df961c86a1748f5beebc4fac98f647c63083f36ae7cb06062f07a0","completed_tasks":29,"evaluable_final_slides":0,"execution_status":"resource_limited","expected_final_slides":18,"public_release_passed":true,"reconstruction_checks_passed":17,"scientific_outcome":"not_evaluable","source_data_processed":false,"tests_passed":188,"tests_skipped":4,"version":"DENSER-autonomous-completion-1"}
